{
  "plan_schema_version": 2,
  "plan_id": "5d2e8a07-91b4-4c3f-8e6a-b7f04c2d1a94",
  "generated_at": "2026-10-23T14:07:30Z",
  "device_id": 57,
  "status": "approved",
  "pack": { "name": "openconfig-interfaces", "version": "1.0.0" },
  "targets": [
    {
      "protocol": "snmp",
      "endpoint": { "credential_ref": "snmp/edge-rtr-07" },
      "subscription": {
        "mode": "poll",
        "interval_seconds": 300,
        "oids": [
          "1.3.6.1.2.1.31.1.1.1.6.3",
          "1.3.6.1.2.1.31.1.1.1.10",
          "1.3.6.1.2.1.2.2.1.14",
          "1.3.6.1.2.1.2.2.1.8"
        ]
      },
      "metrics": [
        {
          "id": "interface.in_octets",
          "type": "counter",
          "unit": "octets",
          "counter_bits": 64,
          "labels": ["name"],
          "source": "1.3.6.1.2.1.31.1.1.1.6.3",
          "binding": { "binding_id": "bnd-d8245d624ea03c83e6f7ce3ced2ef7b7", "resource": { "kind": "interface", "identity": "ge-0/0/1" } }
        },
        { "id": "interface.out_octets", "type": "counter", "unit": "octets", "counter_bits": 64, "labels": ["name"], "source": "1.3.6.1.2.1.31.1.1.1.10" },
        { "id": "interface.in_errors", "type": "counter", "unit": "packets", "counter_bits": 32, "labels": ["name"], "source": "1.3.6.1.2.1.2.2.1.14" },
        { "id": "interface.oper_status", "type": "gauge", "unit": "state", "labels": ["name"], "source": "1.3.6.1.2.1.2.2.1.8" }
      ]
    }
  ],
  "dedup_key": "3b7e2f0d9a4c4e1b8f6a5d2c1b0e9f8a7d6c5b4a3e2f1d0c9b8a7f6e5d4c3b2a"
}
